text,timestamp
Government hiding flood casualties,8/1/2024 10:01
Wake up before it's too late,8/1/2024 10:02
This is all propaganda,8/1/2024 10:03
Don't trust the mainstream media narrative,8/1/2024 10:05
They are poisoning the water supply,8/1/2024 10:15
The election results were obviously rigged,8/1/2024 10:20
Just wait until the truth comes out,8/1/2024 10:12
Why are they tracking our location data?,8/1/2024 10:22
"Stockpile food now, the grid is going down",8/1/2024 10:30
Doctors are being silenced for speaking the truth,8/1/2024 10:45
"It's not a coincidence, it's a plan",8/1/2024 11:00
Refuse to comply with the new mandates,8/1/2024 11:05
They want us to live in fear,8/1/2024 11:10
Secret documents leaked showing the real agenda,8/1/2024 11:15
Climate change is just a tax grab scheme,8/1/2024 11:30
"Protect your family, don't listen to officials",8/1/2024 11:45
